name;price;comm;note;full_link;image
Kişiye Özel Mekanizmalı Deri Cüzdan;26.9;999.0;Aynı Gün Teslimat Seçeneği;https://www.ciceksepeti.com/mekanizmali-deri-cuzdan-kc2546726;https://cdn03.ciceksepeti.com/cicek/kc2546726-1/M/mekanizmali-deri-cuzdan-kc2546726-1-bab6c77b39f34d8a971753b66bcc6db8.jpg
Kişiye Özel İsimli Siyah Benzinli Metal Çakmak;16.9;999.0;Aynı Gün Teslimat Seçeneği;https://www.ciceksepeti.com/kisiye-ozel-isimli-siyah-metal-cakmak-1-kc826450;https://cdn03.ciceksepeti.com/cicek/kc826450-1/M/kisiye-ozel-isimli-siyah-benzinli-metal-cakmak-kc826450-1-753ef953bf93450585197dbbd824c2a7.jpg
Kişiye Özel İsimli Papatya Kolye;19.99;999.0;Aynı Gün Teslimat Seçeneği;https://www.ciceksepeti.com/kisiye-ozel-isimli-papatya-kolye-kc5118532;https://cdn03.ciceksepeti.com/cicek/kc5118532-1/M/kisiye-ozel-simli-papatya-kolye-kc5118532-1-2aca0676276c4ddcb660ef16c6d9e911.jpg
Kişiye Özel Spotify Barkodlu Plak;39.99;999.0;Ücretsiz Kargo;https://www.ciceksepeti.com/kisiye-ozel-spotify-barkodlu-plak-kc103182;https://cdn03.ciceksepeti.com/cicek/kc103182-1/M/kisiye-ozel-spotify-barkodlu-plak-kc103182-1-a7c8843635d34e998c3ba8653be8a868.jpg
Kişiye Özel Telefon Bölmeli Deri Cüzdan;29.99;999.0;Aynı Gün Teslimat Seçeneği;https://www.ciceksepeti.com/kisiye-ozel-telefon-bolmeli-deri-cuzdan-kc1898401;https://cdn03.ciceksepeti.com/cicek/kc1898401-1/M/kisiye-ozel-telefon-bolmeli-deri-cuzdan-kc1898401-1-16c73ee3929f4554a7eb253a4f2836f1.jpg
